yaml_dept_office_names,foia_contacts_names,yaml_office_filename,foia_data
"Region 6 (States: AR, LA, NM, OK, TX)Environmental Protection Agency","Region 6 (States: AR, LA, NM, OK, TX)Environmental Protection Agency","Region 6 (States: AR, LA, NM, OK, TX)_EPA",region 6_epa
"Region 5 (States: IL, IN, MI, MN, OH, WI)Environmental Protection Agency","Region 5 (States: IL, IN, MI, MN, OH, WI)Environmental Protection Agency","Region 5 (States: IL, IN, MI, MN, OH, WI)_EPA",region 5_epa
"Region 4 (States: AL, FL, GA, KY, MS, NC, SC, TN)Environmental Protection Agency","Region 4 (States: AL, FL, GA, KY, MS, NC, SC, TN)Environmental Protection Agency","Region 4 (States: AL, FL, GA, KY, MS, NC, SC, TN)_EPA",region 4_epa
"Region 3 (States: DE, DC, MD, PA, VA, WV)Environmental Protection Agency","Region 3 (States: DE, DC, MD, PA, VA, WV)Environmental Protection Agency","Region 3 (States: DE, DC, MD, PA, VA, WV)_EPA",region 3_epa
"Region 2 (States: NJ, NY, PR VI)Environmental Protection Agency","Region 2 (States: NJ, NY, PR VI)Environmental Protection Agency","Region 2 (States: NJ, NY, PR VI)_EPA",region 2_epa
"Region 10 (States: AK, ID, OR, WA)Environmental Protection Agency","Region 10 (States: AK, ID, OR, WA)Environmental Protection Agency","Region 10 (States: AK, ID, OR, WA)_EPA",region 10_epa
"Region 1 (States: CT, ME, MA, NH, RI, VT)Environmental Protection Agency","Region 1 (States: CT, ME, MA, NH, RI, VT)Environmental Protection Agency","Region 1 (States: CT, ME, MA, NH, RI, VT)_EPA",region 1_epa
National HeadquartersEnvironmental Protection Agency,National HeadquartersEnvironmental Protection Agency,National Headquarters_EPA,headquarters_epa
Export-Import Bank of the U.S.Export-Import Bank of the U.S.,Export-Import Bank of the U.S.Export-Import Bank of the U.S.,Export-Import Bank of the U.S._Ex-Im Bank,export-import bank of the united states_ex-im bank
Office of the Inspector GeneralFederal Labor Relations Authority,Office of the Inspector GeneralFederal Labor Relations Authority,Office of the Inspector General_FLRA,inspector general_flra
The Federal Service Impasses PanelFederal Labor Relations Authority,The Federal Service Impasses PanelFederal Labor Relations Authority,The Federal Service Impasses Panel_FLRA,federal service impasses panel_flra
Office of the Inspector GeneralDepartment of Health and Human Services,Office of the Inspector GeneralDepartment of Health and Human Services,Office of the Inspector General_HHS,office of inspector general_hhs
Center for Medicare and Medicaid ServicesDepartment of Health and Human Services,Center for Medicare and Medicaid ServicesDepartment of Health and Human Services,Center for Medicare and Medicaid Services_HHS,centers for medicare & medicaid services_hhs
"Region X (Seattle, Anchorage, Portland)Department of Housing and Urban Development","Region X (Seattle, Anchorage, Portland)Department of Housing and Urban Development","Region X (Seattle, Anchorage, Portland)_HUD",region 10 -seattle_hud
Region VIII (Denver)Department of Housing and Urban Development,Region VIII (Denver)Department of Housing and Urban Development,Region VIII (Denver)_HUD,region 8 - denver_hud
"Region VII (Kansas City, Des Moines, Omaha, St. Louis)Department of Housing and Urban Development","Region VII (Kansas City, Des Moines, Omaha, St. Louis)Department of Housing and Urban Development","Region VII (Kansas City, Des Moines, Omaha, St. Louis)_HUD",region 7 - kansas_hud
"Region VI (Ft. Worth, Albuquerque, Houston, Little Rock, New Orleans, Oklahoma, San Antonio)Department of Housing and Urban Development","Region VI (Ft. Worth, Albuquerque, Houston, Little Rock, New Orleans, Oklahoma, San Antonio)Department of Housing and Urban Development","Region VI (Ft. Worth, Albuquerque, Houston, Little Rock, New Orleans, Oklahoma, San Antonio)_HUD",region 6 - fort worth_hud
"Region V (Chicago, Columbus, Cleveland, Detroit, Indianapolis, Milwaukee, Minneapolis-St. Paul)Department of Housing and Urban Development","Region V (Chicago, Columbus, Cleveland, Detroit, Indianapolis, Milwaukee, Minneapolis-St. Paul)Department of Housing and Urban Development","Region V (Chicago, Columbus, Cleveland, Detroit, Indianapolis, Milwaukee, Minneapolis-St. Paul)_HUD",region 5 - chicago_hud
"Region IX (San Francisco, Honolulu, Los Angeles, Phoenix, Sacramento)Department of Housing and Urban Development","Region IX (San Francisco, Honolulu, Los Angeles, Phoenix, Sacramento)Department of Housing and Urban Development","Region IX (San Francisco, Honolulu, Los Angeles, Phoenix, Sacramento)_HUD",region 9 - san fracisco_hud
"Region IV (Atlanta, Birmingham, Caribbean, Columbia, Greensboro, Jackson, Jacksonville, Knoxville, Louisville, Nashville, Memphis, Miami, Orlando, Tampa)Department of Housing and Urban Development","Region IV (Atlanta, Birmingham, Caribbean, Columbia, Greensboro, Jackson, Jacksonville, Knoxville, Louisville, Nashville, Memphis, Miami, Orlando, Tampa)Department of Housing and Urban Development","Region IV (Atlanta, Birmingham, Caribbean, Columbia, Greensboro, Jackson, Jacksonville, Knoxville, Louisville, Nashville, Memphis, Miami, Orlando, Tampa)_HUD",region 4 - atlanta_hud
"Region III (Philadelphia, Baltimore, Pittsburgh, Richmond, Washington, D.C., Charleston, Wilmington)Department of Housing and Urban Development","Region III (Philadelphia, Baltimore, Pittsburgh, Richmond, Washington, D.C., Charleston, Wilmington)Department of Housing and Urban Development","Region III (Philadelphia, Baltimore, Pittsburgh, Richmond, Washington, D.C., Charleston, Wilmington)_HUD",region 3 - philadelphia_hud
"Region II (New York, Albany, Buffalo, Camden, Newark, Syracuse)Department of Housing and Urban Development","Region II (New York, Albany, Buffalo, Camden, Newark, Syracuse)Department of Housing and Urban Development","Region II (New York, Albany, Buffalo, Camden, Newark, Syracuse)_HUD",region 2 - new york_hud
"Region I (Boston, Hartford, Manchester, Providence)Department of Housing and Urban Development","Region I (Boston, Hartford, Manchester, Providence)Department of Housing and Urban Development","Region I (Boston, Hartford, Manchester, Providence)_HUD",region 1 - boston_hud
NASA Shared Service Center (NSSC)National Aeronautics and Space Administration,NASA Shared Service Center (NSSC)National Aeronautics and Space Administration,NASA Shared Service Center (NSSC)_NASA,nasa shared services center_nasa
Jet Propulsion LaboratoryNational Aeronautics and Space Administration,Jet Propulsion LaboratoryNational Aeronautics and Space Administration,Jet Propulsion Laboratory_NASA,nasa management office - jet propulsion laboratory_nasa
National Indian Gaming CommissionNational Indian Gaming Commission,National Indian Gaming CommissionNational Indian Gaming Commission,National Indian Gaming Commission_NIGC,national indian gaming commision_nigc
AMTRAKAMTRAK,AMTRAKAMTRAK (National Railroad Passenger Corporation),AMTRAK_NRPC,amtrak (national railroad passenger corporation)_nrpc
Office of Government EthicsOffice of Government Ethics,Office of Government EthicsOffice of Government Ethics,Office of Government Ethics_OGE,united states office of government ethics_oge
Office of Personnel ManagementOffice of Personnel Management,Office of Personnel ManagementOffice of Personnel Management,Office of Personnel Management_OPM,united states office of personnel management_opm
Office of Special CounselOffice of Special Counsel,Office of Special CounselOffice of Special Counsel,Office of Special Counsel_OSC,u.s. office of special counsel_osc
Office of the Inspector GeneralPeace Corps,Office of the Inspector GeneralPeace Corps,Office of the Inspector General_PC,office of inspector general_pc
Small Business AdministrationSmall Business Administration,Small Business AdministrationSmall Business Administration,Small Business Administration_SBA,united states small business administration_sba
Securities and Exchange CommissionSecurities and Exchange Commission,Securities and Exchange CommissionSecurities and Exchange Commission,Securities and Exchange Commission_SEC,united states securities and exchange commission_sec
Department of StateDepartment of State,Department of StateDepartment of State,Department of State_State,united states department of state_state
Internal Revenue Service - Headquarters OfficeDepartment of the Treasury,Internal Revenue Service - Headquarters OfficeDepartment of the Treasury,Internal Revenue Service - Headquarters Office_Treasury,internal revenue service_treasury
Comptroller of the CurrencyDepartment of the Treasury,Comptroller of the CurrencyDepartment of the Treasury,Comptroller of the Currency_Treasury,office of the comptroller of the currency_treasury
Consumer Product Safety CommissionConsumer Product Safety Commission,Consumer Product Safety CommissionConsumer Product Safety Commission,Consumer Product Safety Commission_U.S. CPSC,united states consumer product safety commission_u.s. cpsc
Jobs CorpsDepartment of Labor,Jobs CorpsDepartment of Labor,Jobs Corps_U.S. DOL,job corps_u.s. dol
Veterans' Employment & Training ServiceDepartment of Labor,Veterans' Employment & Training ServiceDepartment of Labor,Veterans' Employment & Training Service_U.S. DOL,veterans' employment and training service_u.s. dol
Office of Workers' Compensation ProgramsDepartment of Labor,Office of Workers' Compensation ProgramsDepartment of Labor,Office of Workers' Compensation Programs_U.S. DOL,office of workers compensation programs_u.s. dol
Office of the Administrative Law JudgesDepartment of Labor,Office of the Administrative Law JudgesDepartment of Labor,Office of the Administrative Law Judges_U.S. DOL,administrative law judges_u.s. dol
Office of Labor-Management StandardsDepartment of Labor,Office of Labor-Management StandardsDepartment of Labor,Office of Labor-Management Standards_U.S. DOL,office of labor management standards_u.s. dol
Office of Federal Contract Compliance ProgramsDepartment of Labor,Office of Federal Contract Compliance ProgramsDepartment of Labor,Office of Federal Contract Compliance Programs_U.S. DOL,office of federal contractor compliance programs_u.s. dol
Occupational Safety & Health AdministrationDepartment of Labor,Occupational Safety & Health AdministrationDepartment of Labor,Occupational Safety & Health Administration_U.S. DOL,occupational safety and health administration_u.s. dol
Mine Safety & Health AdministrationDepartment of Labor,Mine Safety & Health AdministrationDepartment of Labor,Mine Safety & Health Administration_U.S. DOL,mine safety and health administration_u.s. dol
Employment & Training AdministrationDepartment of Labor,Employment & Training AdministrationDepartment of Labor,Employment & Training Administration_U.S. DOL,employment and training administration_u.s. dol
Office of the Inspector GeneralRailroad Retirement Board,Office of the Inspector GeneralRailroad Retirement Board,Office of the Inspector General_US RRB,office of inspector general_us rrb
U.S. Agency for International DevelopmentU.S. Agency for International Development,U.S. Agency for International DevelopmentU.S. Agency for International Development,U.S. Agency for International Development_USAID,united states agency for international development_usaid
Commission on Civil RightsCommission on Civil Rights,Commission on Civil RightsCommission on Civil Rights,Commission on Civil Rights_USCCR,united states commission on civil rights_usccr
Office of the General CounselDepartment of Agriculture,Office of the General CounselDepartment of Agriculture,Office of the General Counsel_USDA,office of general council_usda
Office of the Chief Information OfficerDepartment of Agriculture,Office of the Chief Information OfficerDepartment of Agriculture,Office of the Chief Information Officer_USDA,office of the secretary / office of the chief information officer_usda
Department of AgricultureDepartment of Agriculture,I don't know which officeDepartment of Agriculture,Department of Agriculture_USDA,united states department of agriculture_usda
"Research, Education & EconomicsDepartment of Agriculture","Research, Education & EconomicsDepartment of Agriculture","Research, Education & Economics_USDA","research, education, and economics_usda"
Office of Budget & Program AnalysisDepartment of Agriculture,Office of Budget & Program AnalysisDepartment of Agriculture,Office of Budget & Program Analysis_USDA,office of budget and program analysis_usda
"Grain Inspection, Packers & Stockyards AdministrationDepartment of Agriculture","Grain Inspection, Packers & Stockyards AdministrationDepartment of Agriculture","Grain Inspection, Packers & Stockyards Administration_USDA","grain inspection, packers and stockyards administration_usda"
Forest Service - HeadquartersDepartment of Agriculture,Forest Service - HeadquartersDepartment of Agriculture,Forest Service - Headquarters_USDA,forest service_usda
"Food, Nutrition & Consumer ServicesDepartment of Agriculture","Food, Nutrition & Consumer ServicesDepartment of Agriculture","Food, Nutrition & Consumer Services_USDA",food and nutrition consumer service_usda
Food Safety & Inspection ServiceDepartment of Agriculture,Food Safety & Inspection ServiceDepartment of Agriculture,Food Safety & Inspection Service_USDA,food safety and inspection service_usda
Animal & Plant Health InspectionDepartment of Agriculture,Animal & Plant Health InspectionDepartment of Agriculture,Animal & Plant Health Inspection_USDA,animal and plant health inspection service_usda
United States International Boundary and Water CommissionUnited States International Boundary and Water Commission,United States International Boundary and Water CommissionUnited States International Boundary and Water Commission,United States International Boundary and Water Commission_USIBWC,"united states section, international boundary and water commission_usibwc"
Nuclear Regulatory CommissionNuclear Regulatory Commission,Nuclear Regulatory CommissionNuclear Regulatory Commission,Nuclear Regulatory Commission_USNRC,united states nuclear regulatory commission_usnrc
Office of the Inspector GeneralUnited States Postal Service,Office of the Inspector GeneralUnited States Postal Service,Office of the Inspector General_USPS,office of inspector general for the usps_usps
United States Trade and Development AgencyUnited States Trade and Development Agency,United States Trade and Development AgencyUnited States Trade and Development Agency,United States Trade and Development Agency_USTDA,u.s. trade and development agency_ustda
Office of the United States Trade RepresentativeOffice of the United States Trade Representative,Office of the United States Trade RepresentativeExecutive Office of the President,Office of the United States Trade Representative_USTR,office of the u.s. trade representative_ustr
Office of the General CounselDepartment of Veterans Affairs,Office of the General CounselDepartment of Veterans Affairs,Office of the General Counsel_VA,general counsel_va
Office of Inspector GeneralDepartment of Veterans Affairs,Office of Inspector GeneralDepartment of Veterans Affairs,Office of Inspector General_VA,inspector general_va
Office of Deputy Assistant Secretary for Public AffairsDepartment of Veterans Affairs,Office of Deputy Assistant Secretary for Public AffairsDepartment of Veterans Affairs,Office of Deputy Assistant Secretary for Public Affairs_VA,office of public affairs_va
Office of Deputy Assistant Secretary for FinanceDepartment of Veterans Affairs,Office of Deputy Assistant Secretary for FinanceDepartment of Veterans Affairs,Office of Deputy Assistant Secretary for Finance_VA,office of finance_va
Office of Deputy Assistant Secretary for AdministrationDepartment of Veterans Affairs,Office of Deputy Assistant Secretary for AdministrationDepartment of Veterans Affairs,Office of Deputy Assistant Secretary for Administration_VA,office of the assistant secretary for administration and management_u.s. dol
"Office of the Assistant Secretary for Operations, Security, and PreparednessDepartment of Veterans Affairs","Office of the Assistant Secretary for Operations, Security, and PreparednessDepartment of Veterans Affairs","Office of the Assistant Secretary for Operations, Security, and Preparedness_VA","office of operations, security, and preparedness (formerly s&le - security & law enforcement)_va"
Office of Deputy Assistant Secretary for Human Resources ManagementDepartment of Veterans Affairs,Office of Deputy Assistant Secretary for Human Resources ManagementDepartment of Veterans Affairs,Office of Deputy Assistant Secretary for Human Resources Management_VA,office of human resources management_va
Office of Deputy Assistant Secretary for Diversity and InclusionDepartment of Veterans Affairs,Office of Deputy Assistant Secretary for Diversity and InclusionDepartment of Veterans Affairs,Office of Deputy Assistant Secretary for Diversity and Inclusion_VA,office of diversity and inclusion (formerly dm&eeo - office of diversity management and equal employment opportunity)_va
Office of Deputy Assistant Secretary for BudgetDepartment of Veterans Affairs,Office of Deputy Assistant Secretary for BudgetDepartment of Veterans Affairs,Office of Deputy Assistant Secretary for Budget_VA,office of the deputy assistant secretary for budget_va
Office of Assistant Secretary for Policy and Intergovernmental AffairsDepartment of Veterans Affairs,Office of Assistant Secretary for Policy and Intergovernmental AffairsDepartment of Veterans Affairs,Office of Assistant Secretary for Policy and Intergovernmental Affairs_VA,office of the assistant secretary for public & intergovernmental affairs_va
Office of Assistant Secretary for Information and TechnologyDepartment of Veterans Affairs,Office of Assistant Secretary for Information and TechnologyDepartment of Veterans Affairs,Office of Assistant Secretary for Information and Technology_VA,office of information and technology (005)_va
Office of Assistant Secretary for Human Resources and AdministrationDepartment of Veterans Affairs,Office of Assistant Secretary for Human Resources and AdministrationDepartment of Veterans Affairs,Office of Assistant Secretary for Human Resources and Administration_VA,office of assistant secretary for human resources and administration (006)_va
Office of Assistant Secretary for Congressional and Legislative AffairsDepartment of Veterans Affairs,Office of Assistant Secretary for Congressional and Legislative AffairsDepartment of Veterans Affairs,Office of Assistant Secretary for Congressional and Legislative Affairs_VA,office of congressional and legislative affairs_va
Office of Acquisition & LogisticsDepartment of Veterans Affairs,Office of Acquisition & LogisticsDepartment of Veterans Affairs,Office of Acquisition & Logistics_VA,"office of acquisition, logistics, and construction (formerly a&mm - acquisition & material management)_va"
American Battle Monuments CommissionAmerican Battle Monuments Commission,American Battle Monuments CommissionAmerican Battle Monuments Commission,American Battle Monuments Commission_ABMC,american battle monuments commission_abmc
American Battle Monuments CommissionAmerican Battle Monuments Commission,American Battle Monuments CommissionAmerican Battle Monuments Commission,American Battle Monuments Commission_ABMC,american battle monuments commission_abmc
Administrative Conference of the United StatesAdministrative Conference of the United States,Administrative Conference of the United StatesAdministrative Conference of the United States,Administrative Conference of the United States_ACUS,administrative conference of the united states_acus
Administrative Conference of the United StatesAdministrative Conference of the United States,Administrative Conference of the United StatesAdministrative Conference of the United States,Administrative Conference of the United States_ACUS,administrative conference of the united states_acus
Armed Forces Retirement HomeArmed Forces Retirement Home,Armed Forces Retirement HomeArmed Forces Retirement Home,Armed Forces Retirement Home_AFRH,armed forces retirement home_afrh
Armed Forces Retirement HomeArmed Forces Retirement Home,Armed Forces Retirement HomeArmed Forces Retirement Home,Armed Forces Retirement Home_AFRH,armed forces retirement home_afrh
Broadcasting Board of GovernorsBroadcasting Board of Governors,Broadcasting Board of GovernorsBroadcasting Board of Governors,Broadcasting Board of Governors_BBG,broadcasting board of governors_bbg
Broadcasting Board of GovernorsBroadcasting Board of Governors,Broadcasting Board of GovernorsBroadcasting Board of Governors,Broadcasting Board of Governors_BBG,broadcasting board of governors_bbg
Council on Environmental QualityCouncil on Environmental Quality,Council on Environmental QualityExecutive Office of the President,Council on Environmental Quality_CEQ,council on environmental quality_ceq
Commodity Futures Trading CommissionCommodity Futures Trading Commission,Commodity Futures Trading CommissionCommodity Futures Trading Commission,Commodity Futures Trading Commission_CFTC,commodity futures trading commission_cftc
Central Intelligence AgencyCentral Intelligence Agency,Central Intelligence AgencyCentral Intelligence Agency,Central Intelligence Agency_CIA,central intelligence agency_cia
Central Intelligence AgencyCentral Intelligence Agency,Central Intelligence AgencyCentral Intelligence Agency,Central Intelligence Agency_CIA,central intelligence agency_cia
Council of the Inspectors General on Integrity and EfficiencyCouncil of the Inspectors General on Integrity and Efficiency,Council of the Inspectors General on Integrity and EfficiencyCouncil of the Inspectors General on Integrity and Efficiency,Council of the Inspectors General on Integrity and Efficiency_CIGIE,council of the inspectors general on integrity and efficiency_cigie
Corporation for National and Community ServiceCorporation for National and Community Service,Corporation for National and Community ServiceCorporation for National and Community Service,Corporation for National and Community Service_CNCS,corporation for national and community service_cncs
United States Copyright OfficeUnited States Copyright Office,United States Copyright OfficeUnited States Copyright Office,United States Copyright Office_CO,united states copyright office_co
Committee for Purchase from People Who Are Blind or Severely DisabledCommittee for Purchase from People Who Are Blind or Severely Disabled,Committee for Purchase from People Who Are Blind or Severely DisabledCommittee for Purchase from People Who Are Blind or Severely Disabled,Committee for Purchase from People Who Are Blind or Severely Disabled_CPPBSD,committee for purchase from people who are blind or severely disabled_cppbsd
Chemical Safety and Hazard Investigation BoardChemical Safety and Hazard Investigation Board,Chemical Safety and Hazard Investigation BoardChemical Safety and Hazard Investigation Board,Chemical Safety and Hazard Investigation Board_CSB,chemical safety and hazard investigation board_csb
Court Services and Offender Supervision AgencyCourt Services and Offender Supervision Agency,Court Services and Offender Supervision AgencyCourt Services and Offender Supervision Agency,Court Services and Offender Supervision Agency_CSOSA,court services and offender supervision agency_csosa
Department of Homeland SecurityDepartment of Homeland Security,Department of Homeland SecurityDepartment of Homeland Security,Department of Homeland Security_DHS,department of homeland security_dhs
United States Secret ServiceDepartment of Homeland Security,United States Secret ServiceDepartment of Homeland Security,United States Secret Service_DHS,united states secret service_dhs
Transportation Security AdministrationDepartment of Homeland Security,Transportation Security AdministrationDepartment of Homeland Security,Transportation Security Administration_DHS,transportation security administration_dhs
Office of the Inspector GeneralDepartment of Homeland Security,Office of the Inspector GeneralDepartment of Homeland Security,Office of the Inspector General_DHS,office of the inspector general_dhs
Federal Law Enforcement Training CenterDepartment of Homeland Security,Federal Law Enforcement Training CenterDepartment of Homeland Security,Federal Law Enforcement Training Center_DHS,federal law enforcement training center_dhs
Federal Emergency Management AgencyDepartment of Homeland Security,Federal Emergency Management AgencyDepartment of Homeland Security,Federal Emergency Management Agency_DHS,federal emergency management agency_dhs
Department of Homeland SecurityDepartment of Homeland Security,I don't know which officeDepartment of Homeland Security,Department of Homeland Security_DHS,department of homeland security_dhs
Defense Nuclear Facilities Safety BoardDefense Nuclear Facilities Safety Board,Defense Nuclear Facilities Safety BoardDefense Nuclear Facilities Safety Board,Defense Nuclear Facilities Safety Board_DNFSB,defense nuclear facilities safety board_dnfsb
Department of CommerceDepartment of Commerce,Department of CommerceDepartment of Commerce,Department of Commerce_DOC,united states department of commerce_doc
Office of the SecretaryDepartment of Commerce,Office of the SecretaryDepartment of Commerce,Office of the Secretary_DOC,office of the secretary_doc
Office of Inspector GeneralDepartment of Commerce,Office of Inspector GeneralDepartment of Commerce,Office of Inspector General_DOC,office of inspector general_doc
National Telecommunications and Information AdministrationDepartment of Commerce,National Telecommunications and Information AdministrationDepartment of Commerce,National Telecommunications and Information Administration_DOC,national telecommunications and information administration_doc
National Technical Information ServiceDepartment of Commerce,National Technical Information ServiceDepartment of Commerce,National Technical Information Service_DOC,national technical information service_doc
