yaml_dept_office_names,foia_contacts_names,yaml_office_filename,foia_data
National Oceanic and Atmospheric AdministrationDepartment of Commerce,National Oceanic and Atmospheric AdministrationDepartment of Commerce,National Oceanic and Atmospheric Administration_DOC,national oceanic and atmospheric administration_doc
National Institute of Standards and TechnologyDepartment of Commerce,National Institute of Standards and TechnologyDepartment of Commerce,National Institute of Standards and Technology_DOC,national institute of standards and technology_doc
Minority Business Development AgencyDepartment of Commerce,Minority Business Development AgencyDepartment of Commerce,Minority Business Development Agency_DOC,minority business development agency_doc
International Trade AdministrationDepartment of Commerce,International Trade AdministrationDepartment of Commerce,International Trade Administration_DOC,international trade administration_doc
Economic Development AdministrationDepartment of Commerce,Economic Development AdministrationDepartment of Commerce,Economic Development Administration_DOC,economic development administration_doc
Department of DefenseDepartment of Defense,Department of DefenseDepartment of Defense,Department of Defense_DoD,department of defense_dod
National Security AgencyDepartment of Defense,National Security AgencyDepartment of Defense,National Security Agency_DoD,national security agency_dod
National Reconnaissance OfficeDepartment of Defense,National Reconnaissance OfficeDepartment of Defense,National Reconnaissance Office_DoD,national reconnaissance office_dod
National Guard BureauDepartment of Defense,National Guard BureauDepartment of Defense,National Guard Bureau_DoD,national guard bureau_dod
Defense Technical Information CenterDepartment of Defense,Defense Technical Information CenterDepartment of Defense,Defense Technical Information Center_DoD,defense technical information center_dod
Defense Security ServiceDepartment of Defense,Defense Security ServiceDepartment of Defense,Defense Security Service_DoD,defense security service_dod
Defense Intelligence AgencyDepartment of Defense,Defense Intelligence AgencyDepartment of Defense,Defense Intelligence Agency_DoD,defense intelligence agency_dod
Defense Finance and Accounting ServiceDepartment of Defense,Defense Finance and Accounting ServiceDepartment of Defense,Defense Finance and Accounting Service_DoD,defense finance and accounting service_dod
Defense Contract Management AgencyDepartment of Defense,Defense Contract Management AgencyDepartment of Defense,Defense Contract Management Agency_DoD,defense contract management agency_dod
Defense Commissary AgencyDepartment of Defense,Defense Commissary AgencyDepartment of Defense,Defense Commissary Agency_DoD,defense commissary agency_dod
Department of EnergyDepartment of Energy,Department of EnergyDepartment of Energy,Department of Energy_DOE,department of energy_doe
Western Area Power AdministrationDepartment of Energy,Western Area Power AdministrationDepartment of Energy,Western Area Power Administration_DOE,western area power administration_doe
Southwestern Power AdministrationDepartment of Energy,Southwestern Power AdministrationDepartment of Energy,Southwestern Power Administration_DOE,southwestern power administration_doe
Savannah River Operations OfficeDepartment of Energy,Savannah River Operations OfficeDepartment of Energy,Savannah River Operations Office_DOE,savannah river operations office_doe
Richland Operations OfficeDepartment of Energy,Richland Operations OfficeDepartment of Energy,Richland Operations Office_DOE,richland operations office_doe
Office of Scientific and Technical InformationDepartment of Energy,Office of Scientific and Technical InformationDepartment of Energy,Office of Scientific and Technical Information_DOE,office of scientific and technical information_doe
Oak Ridge OfficeDepartment of Energy,Oak Ridge OfficeDepartment of Energy,Oak Ridge Office_DOE,oak ridge office_doe
National Energy Technology LaboratoryDepartment of Energy,National Energy Technology LaboratoryDepartment of Energy,National Energy Technology Laboratory_DOE,national energy technology laboratory_doe
Idaho Operations OfficeDepartment of Energy,Idaho Operations OfficeDepartment of Energy,Idaho Operations Office_DOE,idaho operations office_doe
HeadquartersDepartment of Energy,HeadquartersDepartment of Energy,Headquarters_DOE,headquarters_doe
Golden Field OfficeDepartment of Energy,Golden Field OfficeDepartment of Energy,Golden Field Office_DOE,golden field office_doe
Bonneville Power AdministrationDepartment of Energy,Bonneville Power AdministrationDepartment of Energy,Bonneville Power Administration_DOE,bonneville power administration_doe
Department of InteriorDepartment of Interior,Department of InteriorDepartment of Interior,Department of Interior_DOI,department of the interior_doi
Office of the SolicitorDepartment of Interior,Office of the SolicitorDepartment of Interior,Office of the Solicitor_DOI,office of the solicitor_doi
Office of the SecretaryDepartment of Interior,Office of the SecretaryDepartment of Interior,Office of the Secretary_DOI,office of the secretary_doi
Office of Surface MiningDepartment of Interior,Office of Surface MiningDepartment of Interior,Office of Surface Mining_DOI,office of surface mining_doi
National Park ServiceDepartment of Interior,National Park ServiceDepartment of Interior,National Park Service_DOI,national park service_doi
Bureau of Safety and Environmental EnforcementDepartment of Interior,Bureau of Safety and Environmental EnforcementDepartment of Interior,Bureau of Safety and Environmental Enforcement_DOI,bureau of safety and environmental enforcement_doi
Bureau of ReclamationDepartment of Interior,Bureau of ReclamationDepartment of Interior,Bureau of Reclamation_DOI,bureau of reclamation_doi
Bureau of Ocean Energy ManagementDepartment of Interior,Bureau of Ocean Energy ManagementDepartment of Interior,Bureau of Ocean Energy Management_DOI,bureau of ocean energy management_doi
Bureau of Land ManagementDepartment of Interior,Bureau of Land ManagementDepartment of Interior,Bureau of Land Management_DOI,bureau of land management_doi
Bureau of Indian AffairsDepartment of Interior,Bureau of Indian AffairsDepartment of Interior,Bureau of Indian Affairs_DOI,bureau of indian affairs_doi
Department of JusticeDepartment of Justice,Department of JusticeDepartment of Justice,Department of Justice_DOJ,department of justice_doj
United States Parole CommissionDepartment of Justice,United States Parole CommissionDepartment of Justice,United States Parole Commission_DOJ,united states parole commission_doj
United States Marshals ServiceDepartment of Justice,United States Marshals ServiceDepartment of Justice,United States Marshals Service_DOJ,united states marshals service_doj
Tax DivisionDepartment of Justice,Tax DivisionDepartment of Justice,Tax Division_DOJ,tax division_doj
Professional Responsibility Advisory OfficeDepartment of Justice,Professional Responsibility Advisory OfficeDepartment of Justice,Professional Responsibility Advisory Office_DOJ,professional responsibility advisory office_doj
Office on Violence Against WomenDepartment of Justice,Office on Violence Against WomenDepartment of Justice,Office on Violence Against Women_DOJ,office on violence against women_doj
Office of the Solicitor GeneralDepartment of Justice,Office of the Solicitor GeneralDepartment of Justice,Office of the Solicitor General_DOJ,office of the solicitor general_doj
Office of the Pardon AttorneyDepartment of Justice,Office of the Pardon AttorneyDepartment of Justice,Office of the Pardon Attorney_DOJ,office of the pardon attorney_doj
Office of the Inspector GeneralDepartment of Justice,Office of the Inspector GeneralDepartment of Justice,Office of the Inspector General_DOJ,office of the inspector general_doj
Office of the Deputy Attorney GeneralDepartment of Justice,Office of the Deputy Attorney GeneralDepartment of Justice,Office of the Deputy Attorney General_DOJ,office of the deputy attorney general_doj
Office of the Attorney GeneralDepartment of Justice,Office of the Attorney GeneralDepartment of Justice,Office of the Attorney General_DOJ,office of the attorney general_doj
Office of the Associate Attorney GeneralDepartment of Justice,Office of the Associate Attorney GeneralDepartment of Justice,Office of the Associate Attorney General_DOJ,office of the associate attorney general_doj
Office of Public AffairsDepartment of Justice,Office of Public AffairsDepartment of Justice,Office of Public Affairs_DOJ,office of public affairs_doj
Office of Professional ResponsibilityDepartment of Justice,Office of Professional ResponsibilityDepartment of Justice,Office of Professional Responsibility_DOJ,office of professional responsibility_doj
Office of Legislative AffairsDepartment of Justice,Office of Legislative AffairsDepartment of Justice,Office of Legislative Affairs_DOJ,office of legislative affairs_doj
Office of Legal PolicyDepartment of Justice,Office of Legal PolicyDepartment of Justice,Office of Legal Policy_DOJ,office of legal policy_doj
Office of Legal CounselDepartment of Justice,Office of Legal CounselDepartment of Justice,Office of Legal Counsel_DOJ,office of legal counsel_doj
Office of Justice ProgramsDepartment of Justice,Office of Justice ProgramsDepartment of Justice,Office of Justice Programs_DOJ,office of justice programs_doj
Office of Information PolicyDepartment of Justice,Office of Information PolicyDepartment of Justice,Office of Information Policy_DOJ,office of information policy_doj
Office of Community Oriented Policing ServicesDepartment of Justice,Office of Community Oriented Policing ServicesDepartment of Justice,Office of Community Oriented Policing Services_DOJ,office of community oriented policing services_doj
National Security DivisionDepartment of Justice,National Security DivisionDepartment of Justice,National Security Division_DOJ,national security division_doj
Justice Management DivisionDepartment of Justice,Justice Management DivisionDepartment of Justice,Justice Management Division_DOJ,justice management division_doj
Foreign Claims Settlement CommissionDepartment of Justice,Foreign Claims Settlement CommissionDepartment of Justice,Foreign Claims Settlement Commission_DOJ,foreign claims settlement commission_doj
Federal Bureau of InvestigationDepartment of Justice,Federal Bureau of InvestigationDepartment of Justice,Federal Bureau of Investigation_DOJ,federal bureau of investigation_doj
Executive Office for United States TrusteesDepartment of Justice,Executive Office for United States TrusteesDepartment of Justice,Executive Office for United States Trustees_DOJ,executive office for united states trustees_doj
Executive Office for United States AttorneysDepartment of Justice,Executive Office for United States AttorneysDepartment of Justice,Executive Office for United States Attorneys_DOJ,executive office for united states attorneys_doj
Executive Office for Organized Crime Drug Enforcement Task ForcesDepartment of Justice,Executive Office for Organized Crime Drug Enforcement Task ForcesDepartment of Justice,Executive Office for Organized Crime Drug Enforcement Task Forces_DOJ,executive office for organized crime drug enforcement task forces_doj
Executive Office for Immigration ReviewDepartment of Justice,Executive Office for Immigration ReviewDepartment of Justice,Executive Office for Immigration Review_DOJ,executive office for immigration review_doj
Environment and Natural Resources DivisionDepartment of Justice,Environment and Natural Resources DivisionDepartment of Justice,Environment and Natural Resources Division_DOJ,environment and natural resources division_doj
Drug Enforcement AdministrationDepartment of Justice,Drug Enforcement AdministrationDepartment of Justice,Drug Enforcement Administration_DOJ,drug enforcement administration_doj
Criminal DivisionDepartment of Justice,Criminal DivisionDepartment of Justice,Criminal Division_DOJ,criminal division_doj
Community Relations ServiceDepartment of Justice,Community Relations ServiceDepartment of Justice,Community Relations Service_DOJ,community relations service_doj
Civil Rights DivisionDepartment of Justice,Civil Rights DivisionDepartment of Justice,Civil Rights Division_DOJ,civil rights division_doj
Civil DivisionDepartment of Justice,Civil DivisionDepartment of Justice,Civil Division_DOJ,civil division_doj
Antitrust DivisionDepartment of Justice,Antitrust DivisionDepartment of Justice,Antitrust Division_DOJ,antitrust division_doj
Department of JusticeDepartment of Justice,I don't know which officeDepartment of Justice,Department of Justice_DOJ,department of justice_doj
Department of TransportationDepartment of Transportation,Department of TransportationDepartment of Transportation,Department of Transportation_DOT,department of transportation_dot
Saint Lawrence Seaway Development CorporationDepartment of Transportation,Saint Lawrence Seaway Development CorporationDepartment of Transportation,Saint Lawrence Seaway Development Corporation_DOT,saint lawrence seaway development corporation_dot
Pipeline and Hazardous Materials Safety AdministrationDepartment of Transportation,Pipeline and Hazardous Materials Safety AdministrationDepartment of Transportation,Pipeline and Hazardous Materials Safety Administration_DOT,pipeline and hazardous materials safety administration_dot
Office of the SecretaryDepartment of Transportation,Office of the SecretaryDepartment of Transportation,Office of the Secretary_DOT,office of the secretary_dot
National Highway Traffic Safety AdministrationDepartment of Transportation,National Highway Traffic Safety AdministrationDepartment of Transportation,National Highway Traffic Safety Administration_DOT,national highway traffic safety administration_dot
Maritime AdministrationDepartment of Transportation,Maritime AdministrationDepartment of Transportation,Maritime Administration_DOT,maritime administration_dot
Federal Transit AdministrationDepartment of Transportation,Federal Transit AdministrationDepartment of Transportation,Federal Transit Administration_DOT,federal transit administration_dot
Federal Railroad AdministrationDepartment of Transportation,Federal Railroad AdministrationDepartment of Transportation,Federal Railroad Administration_DOT,federal railroad administration_dot
Federal Motor Carrier Safety AdministrationDepartment of Transportation,Federal Motor Carrier Safety AdministrationDepartment of Transportation,Federal Motor Carrier Safety Administration_DOT,federal motor carrier safety administration_dot
Federal Highway AdministrationDepartment of Transportation,Federal Highway AdministrationDepartment of Transportation,Federal Highway Administration_DOT,federal highway administration_dot
Federal Aviation AdministrationDepartment of Transportation,Federal Aviation AdministrationDepartment of Transportation,Federal Aviation Administration_DOT,federal aviation administration_dot
Department of TransportationDepartment of Transportation,I don't know which officeDepartment of Transportation,Department of Transportation_DOT,department of transportation_dot
Department of EducationDepartment of Education,Department of EducationDepartment of Education,Department of Education_ED,department of education_ed
Equal Employment Opportunity CommissionEqual Employment Opportunity Commission,Equal Employment Opportunity CommissionEqual Employment Opportunity Commission,Equal Employment Opportunity Commission_EEOC,equal employment opportunity commission_eeoc
Washington Field OfficeEqual Employment Opportunity Commission,Washington Field OfficeEqual Employment Opportunity Commission,Washington Field Office_EEOC,washington field office_eeoc
Equal Employment Opportunity CommissionEqual Employment Opportunity Commission,I don't know which officeEqual Employment Opportunity Commission,Equal Employment Opportunity Commission_EEOC,equal employment opportunity commission_eeoc
Environmental Protection AgencyEnvironmental Protection Agency,Environmental Protection AgencyEnvironmental Protection Agency,Environmental Protection Agency_EPA,environmental protection agency_epa
Environmental Protection AgencyEnvironmental Protection Agency,I don't know which officeEnvironmental Protection Agency,Environmental Protection Agency_EPA,environmental protection agency_epa
Farm Credit AdministrationFarm Credit Administration,Farm Credit AdministrationFarm Credit Administration,Farm Credit Administration_FCA,farm credit administration_fca
Federal Communications CommissionFederal Communications Commission,Federal Communications CommissionFederal Communications Commission,Federal Communications Commission_FCC,federal communications commission_fcc
Farm Credit System Insurance CorporationFarm Credit System Insurance Corporation,Farm Credit System Insurance CorporationFarm Credit System Insurance Corporation,Farm Credit System Insurance Corporation_FCSIC,farm credit system insurance corporation_fcsic
Federal Deposit Insurance CorporationFederal Deposit Insurance Corporation,Federal Deposit Insurance CorporationFederal Deposit Insurance Corporation,Federal Deposit Insurance Corporation_FDIC,federal deposit insurance corporation_fdic
Federal Election CommissionFederal Election Commission,Federal Election CommissionFederal Election Commission,Federal Election Commission_FEC,federal election commission_fec
Federal Election CommissionFederal Election Commission,Federal Election CommissionFederal Election Commission,Federal Election Commission_FEC,federal election commission_fec
Federal Election CommissionFederal Election Commission,Federal Election CommissionFederal Election Commission,Federal Election Commission_FEC,federal election commission_fec
Federal Energy Regulatory CommissionFederal Energy Regulatory Commission,Federal Energy Regulatory CommissionFederal Energy Regulatory Commission,Federal Energy Regulatory Commission_FERC,federal energy regulatory commission_ferc
Federal Housing Finance AgencyFederal Housing Finance Agency,Federal Housing Finance AgencyFederal Housing Finance Agency,Federal Housing Finance Agency_FHFA,federal housing finance agency_fhfa
Federal Labor Relations AuthorityFederal Labor Relations Authority,Federal Labor Relations AuthorityFederal Labor Relations Authority,Federal Labor Relations Authority_FLRA,federal labor relations authority_flra
Washington Regional OfficeFederal Labor Relations Authority,Washington Regional OfficeFederal Labor Relations Authority,Washington Regional Office_FLRA,washington regional office_flra
San Francisco Regional OfficeFederal Labor Relations Authority,San Francisco Regional OfficeFederal Labor Relations Authority,San Francisco Regional Office_FLRA,san francisco regional office_flra
Office of the General CounselFederal Labor Relations Authority,Office of the General CounselFederal Labor Relations Authority,Office of the General Counsel_FLRA,office of the general counsel_flra
Denver Regional OfficeFederal Labor Relations Authority,Denver Regional OfficeFederal Labor Relations Authority,Denver Regional Office_FLRA,denver regional office_flra
Dallas Regional OfficeFederal Labor Relations Authority,Dallas Regional OfficeFederal Labor Relations Authority,Dallas Regional Office_FLRA,dallas regional office_flra
Chicago Regional OfficeFederal Labor Relations Authority,Chicago Regional OfficeFederal Labor Relations Authority,Chicago Regional Office_FLRA,chicago regional office_flra
Boston Regional OfficeFederal Labor Relations Authority,Boston Regional OfficeFederal Labor Relations Authority,Boston Regional Office_FLRA,boston regional office_flra
Atlanta Regional OfficeFederal Labor Relations Authority,Atlanta Regional OfficeFederal Labor Relations Authority,Atlanta Regional Office_FLRA,atlanta regional office_flra
Federal Labor Relations AuthorityFederal Labor Relations Authority,I don't know which officeFederal Labor Relations Authority,Federal Labor Relations Authority_FLRA,federal labor relations authority_flra
Federal Maritime CommissionFederal Maritime Commission,Federal Maritime CommissionFederal Maritime Commission,Federal Maritime Commission_FMC,federal maritime commission_fmc
Federal Mediation and Conciliation ServiceFederal Mediation and Conciliation Service,Federal Mediation and Conciliation ServiceFederal Mediation and Conciliation Service,Federal Mediation and Conciliation Service_FMCS,federal mediation and conciliation service_fmcs
Federal Mediation and Conciliation ServiceFederal Mediation and Conciliation Service,Federal Mediation and Conciliation ServiceFederal Mediation and Conciliation Service,Federal Mediation and Conciliation Service_FMCS,federal mediation and conciliation service_fmcs
Federal Mediation and Conciliation ServiceFederal Mediation and Conciliation Service,Federal Mediation and Conciliation ServiceFederal Mediation and Conciliation Service,Federal Mediation and Conciliation Service_FMCS,federal mediation and conciliation service_fmcs
Federal Mine Safety and Health Review CommissionFederal Mine Safety and Health Review Commission,Federal Mine Safety and Health Review CommissionFederal Mine Safety and Health Review Commission,Federal Mine Safety and Health Review Commission_FMSHRC,federal mine safety and health review commission_fmshrc
Federal Open Market CommitteeFederal Open Market Committee,Federal Open Market CommitteeFederal Open Market Committee,Federal Open Market Committee_FOMC,federal open market committee_fomc
Federal Open Market CommitteeFederal Open Market Committee,Federal Open Market CommitteeFederal Open Market Committee,Federal Open Market Committee_FOMC,federal open market committee_fomc
Federal Open Market CommitteeFederal Open Market Committee,Federal Open Market CommitteeFederal Open Market Committee,Federal Open Market Committee_FOMC,federal open market committee_fomc
Federal Retirement Thrift Investment BoardFederal Retirement Thrift Investment Board,Federal Retirement Thrift Investment BoardFederal Retirement Thrift Investment Board,Federal Retirement Thrift Investment Board_FRTIB,federal retirement thrift investment board_frtib
Federal Trade CommissionFederal Trade Commission,Federal Trade CommissionFederal Trade Commission,Federal Trade Commission_FTC,federal trade commission_ftc
General Services AdministrationGeneral Services Administration,General Services AdministrationGeneral Services Administration,General Services Administration_GSA,u. s. general services  administration_gsa
Department of Health and Human ServicesDepartment of Health and Human Services,Department of Health and Human ServicesDepartment of Health and Human Services,Department of Health and Human Services_HHS,united sates department of health and human services_hhs
Substance Abuse and Mental Health Services AdministrationDepartment of Health and Human Services,Substance Abuse and Mental Health Services AdministrationDepartment of Health and Human Services,Substance Abuse and Mental Health Services Administration_HHS,substance abuse and mental health services administration_hhs
Program Support CenterDepartment of Health and Human Services,Program Support CenterDepartment of Health and Human Services,Program Support Center_HHS,program support center_hhs
Office of the SecretaryDepartment of Health and Human Services,Office of the SecretaryDepartment of Health and Human Services,Office of the Secretary_HHS,office of the secretary_hhs
National Institutes of HealthDepartment of Health and Human Services,National Institutes of HealthDepartment of Health and Human Services,National Institutes of Health_HHS,national institutes of health_hhs
Indian Health ServiceDepartment of Health and Human Services,Indian Health ServiceDepartment of Health and Human Services,Indian Health Service_HHS,indian health service_hhs
Health Resources and Services AdministrationDepartment of Health and Human Services,Health Resources and Services AdministrationDepartment of Health and Human Services,Health Resources and Services Administration_HHS,health resources and services administration_hhs
Food and Drug AdministrationDepartment of Health and Human Services,Food and Drug AdministrationDepartment of Health and Human Services,Food and Drug Administration_HHS,food and drug administration_hhs
Centers for Disease Control and PreventionDepartment of Health and Human Services,Centers for Disease Control and PreventionDepartment of Health and Human Services,Centers for Disease Control and Prevention_HHS,centers for disease control and prevention_hhs
Agency for Healthcare Research and QualityDepartment of Health and Human Services,Agency for Healthcare Research and QualityDepartment of Health and Human Services,Agency for Healthcare Research and Quality_HHS,agency for healthcare research and quality_hhs
Administration for Community LivingDepartment of Health and Human Services,Administration for Community LivingDepartment of Health and Human Services,Administration for Community Living_HHS,administration for community living_hhs
Administration for Children and FamiliesDepartment of Health and Human Services,Administration for Children and FamiliesDepartment of Health and Human Services,Administration for Children and Families_HHS,administration for children and families_hhs
Department of Housing and Urban DevelopmentDepartment of Housing and Urban Development,Department of Housing and Urban DevelopmentDepartment of Housing and Urban Development,Department of Housing and Urban Development_HUD,department of housing and urban development_hud
HeadquartersDepartment of Housing and Urban Development,HeadquartersDepartment of Housing and Urban Development,Headquarters_HUD,headquarters_hud
Department of Housing and Urban DevelopmentDepartment of Housing and Urban Development,I don't know which officeDepartment of Housing and Urban Development,Department of Housing and Urban Development_HUD,department of housing and urban development_hud
